Termino,Titulo,Descripcion,Source,Temporalidad,Link,Thumbnail,ImageName
juarez irene garza rodriguez,F?lix Arratia busca sacar a las dinast?as en Ju?rez,El candidato de MC asegur? que la gente necesita un cambio y por eso su campa?a se centrar? en seguridad transporte p?blico y servicios p?blicos.,MVS Noticias,Sun Mar 31 2024 00:00:00 GMT-0600 (Central Standard Time),https://mvsnoticias.com/nuevo-leon/2024/3/31/felix-arratia-busca-sacar-las-dinastias-en-juarez-632956.html,12KyLo0mEMUkOe8mGC94wvOBItHXKELee,https___mvsnoticias_com_nuevo_leon_2024_3_31_felix_arratia_busca_sacar_las_dinastias_en_juarez_632956_html.jpeg
felix arratia,F?lix Arratia lleva agua a colonias de Ju?rez,El alcalde electo de Ju?rez F?lix Arratia respondi? a reportes de falta de agua tras la Tormenta Tropical "Alberto",MVS Noticias,Wed Jun 26 2024 00:00:00 GMT-0600 (Central Standard Time),https://mvsnoticias.com/nuevo-leon/2024/6/26/felix-arratia-lleva-agua-colonias-de-juarez-645593.html,17NpMdtLHdf6sp3twyXJP5A7irL5p1Qqg,https___mvsnoticias_com_nuevo_leon_2024_6_26_felix_arratia_lleva_agua_colonias_de_juarez_645593_html.png
felix arratia,Entregan a estudiantes ?tiles escolares en Ju?rez,F?lix Arratia convoc? a trav?s de sus redes la entrega de kits escolares para apoyar a las familias con los gastos de ?tiles.,ABCNoticias.MX,Tue Aug 13 2024 00:00:00 GMT-0600 (Central Standard Time),https://abcnoticias.mx/local/2024/8/13/entregan-estudiantes-utiles-escolares-en-juarez-223559.html,1Mi5WxjeALAVdjDylnVARhcgj9vQM2cZc,https___abcnoticias_mx_local_2024_8_13_entregan_estudiantes_utiles_escolares_en_juarez_223559_html.jpeg
felix arratia,Entrega F?lix Arratia kits de ?tiles escolares a familias de Ju?rez,Entrega F?lix Arratia kits de ?tiles escolares a familias de Ju?rez ... El alcalde electo de Ju?rez F?lix Arratia comenz? con la entrega de kits b?sicos de...,noticiasnuevoleon.com.mx,Tue Aug 13 2024 00:00:00 GMT-0600 (Central Standard Time),https://noticiasnuevoleon.com.mx/2024/08/entrega-felix-arratia-kits-de-utiles-escolares-a-familias-de-juarez/,1BNvvCw1tw3wmi7i143J4MFldwX3Cv1r1,https___noticiasnuevoleon_com_mx_2024_08_entrega_felix_arratia_kits_de_utiles_escolares_a_familias_de_juarez_.jpeg
felix arratia,Alcaldes electos de Guadalupe Ju?rez y Cadereyta piden a Banobras recursos,Con estos recursos los alcaldes planean construir obras para enfrentar los da?os que dej? la tormenta Alberto.,ABCNoticias.MX,Wed Aug 21 2024 00:00:00 GMT-0600 (Central Standard Time),https://abcnoticias.mx/local/2024/8/21/alcaldes-electos-de-guadalupe-juarez-cadereyta-piden-banobras-recursos-224187.html,1LJMNG3AM_jfQVNWVrW5dEi3Tw112MkTa,https___abcnoticias_mx_local_2024_8_21_alcaldes_electos_de_guadalupe_juarez_cadereyta_piden_banobras_recursos_224187_html.jpeg
felix arratia,F?lix Arratia ofrece gobierno profesional y honesto al iniciar la transici?n en Ju?rez,F?lix Arratia ofrece gobierno profesional y honesto al iniciar la transici?n en Ju?rez ... El alcalde electo de Ju?rez F?lix Arratia inici? el proceso de entrega...,Noticias Nuevo Le?n,Mon Aug 26 2024 00:00:00 GMT-0600 (Central Standard Time),https://noticiasnuevoleon.com.mx/2024/08/felix-arratia-ofrece-gobierno-profesional-y-honesto-al-iniciar-la-transicion-en-juarez/,17fBcoTYBHZ_cbWaqFuy43wRFyHghETNa,https___noticiasnuevoleon_com_mx_2024_08_felix_arratia_ofrece_gobierno_profesional_y_honesto_al_iniciar_la_transicion_en_juarez_.jpeg
felix arratia,F?lix Arratia inicia transici?n en Ju?rez; ofreci? un gobierno profesional y honesto,Arratia agradeci? la disposici?n y apertura del actual alcalde Francisco Trevi?o para llevar un proceso de entrega - recepci?n respetuoso. ... Ju?rez.- F?lix...,ABCNoticias.MX,Tue Aug 27 2024 00:00:00 GMT-0600 (Central Standard Time),https://abcnoticias.mx/local/2024/8/27/felix-arratia-inicia-transicion-en-juarez-ofrecio-un-gobierno-profesional-honesto-224526.html,1yjMWtpsU-INTRrfXt_14ZFicjjXJdQxz,https___abcnoticias_mx_local_2024_8_27_felix_arratia_inicia_transicion_en_juarez_ofrecio_un_gobierno_profesional_honesto_224526_html.jpeg
felix arratia; juarez americo garza salinas,Anuncia Arratia a Am?rico Garza como su secretario de Ayuntamiento,El alcalde electo de Ju?rez destac? que el pr?ximo Secretario del Ayuntamiento est? comprometido con construir un nuevo municipio.,El Porvenir,Tue Aug 27 2024 00:00:00 GMT-0600 (Central Standard Time),https://elporvenir.mx/local/anuncia-arratia-a-americo-garza-como-su-secretario-de-ayuntamiento/765824,1YAwcy3XnHUEHAuPR_HgdZlWDHyEvI-kI,https___elporvenir_mx_local_anuncia_arratia_a_americo_garza_como_su_secretario_de_ayuntamiento_765824.jpeg
felix arratia,Nos est?n dejando un municipio sin recursos: F?lix Arratia,El alcalde electo de Ju?rez F?lix Arratia coment? que peligra el aguinaldo de los trabajadores de este municipio.,POSTA,Fri Aug 30 2024 00:00:00 GMT-0600 (Central Standard Time),https://www.posta.com.mx/nuevoleon/nos-estan-dejando-un-municipio-sin-recursos-felix-arratia/v-vl1608548,1ue6jxQNr8QTkj7k1grHWtAXurjSoab-X,https___www_posta_com_mx_nuevoleon_nos_estan_dejando_un_municipio_sin_recursos_felix_arratia_v_vl1608548.jpeg
felix arratia,Suman mil 'aviadores' en n?mina de Ju?rez Nuevo Le?n,No ser?an 400 como lo dijo el secretario de Ayuntamiento entrante Am?rico Garza sino mil seg?n estima el pr?ximo alcalde juarense F?lix Arratia.,ABCNoticias.MX,Wed Sep 04 2024 00:00:00 GMT-0600 (Central Standard Time),https://abcnoticias.mx/local/2024/9/4/suman-mil-aviadores-en-nomina-de-juarez-nuevo-leon-225202.html,1xsPT-Df7BTszrbbx646AINoixX0UA1t6,https___abcnoticias_mx_local_2024_9_4_suman_mil_aviadores_en_nomina_de_juarez_nuevo_leon_225202_html.jpeg
benito juarez nuevo leon,Inauguran el primer Centro de Autismo en el municipio de Ju?rez NL,El municipio de Ju?rez Nuevo Le?n inaugur? su primer Centro de Autismo y Trastornos Neurodiversos perteneciente al DIF municipal donde se dar? atenci?n...,Reporte Indigo,Thu Sep 05 2024 00:00:00 GMT-0600 (Central Standard Time),https://www.reporteindigo.com/reporte/inauguran-el-primer-centro-de-autismo-en-el-municipio-de-juarez-nl/,1hgY62pgafE_is8_5KDL0QBM9TbT83-bh,https___www_reporteindigo_com_reporte_inauguran_el_primer_centro_de_autismo_en_el_municipio_de_juarez_nl_.jpeg
juarez n.l.; benito juarez nuevo leon; juarez nl; benito juarez n.l.,El municipio de Ju?rez celebrar? la Independencia con una gran fiesta,Los asistentes podr?n disfrutar de una celebraci?n llena de m?sica y emoci?n con presentaciones en vivo de grandes artistas.,POSTA,Fri Sep 06 2024 00:00:00 GMT-0600 (Central Standard Time),https://www.posta.com.mx/nuevoleon/el-municipio-de-juarez-celebrara-la-independencia-con-una-gran-fiesta/vl1611007,14VAUNAfIvV0dpGwTNRHf_IiPzKUwElnI,https___www_posta_com_mx_nuevoleon_el_municipio_de_juarez_celebrara_la_independencia_con_una_gran_fiesta_vl1611007.png
felix arratia,Anuncia alcalde elector de Ju?rez programa liquida y ahorra para ponerse al corriente con el pago del agua,Anuncia alcalde elector de Ju?rez F?lix Arratia que lleg? a un acuerdo con autoridades de agua de drenaje de Monterrey para beneficiar a aquellos...,Noticias Nuevo Le?n,Mon Sep 09 2024 00:00:00 GMT-0600 (Central Standard Time),https://noticiasnuevoleon.com.mx/2024/09/anuncia-alcalde-elector-de-juarez-programa-liquida-y-ahorra-para-ponerse-al-corriente-con-el-pago-del-agua/,1adjafNbgYK3hJFZTe4zEHzG_kvNLCNdQ,https___noticiasnuevoleon_com_mx_2024_09_anuncia_alcalde_elector_de_juarez_programa_liquida_y_ahorra_para_ponerse_al_corriente_con_el_pago_del_agua_.png
felix arratia,Realiza F?lix Arratia trabajos de desmonte y limpieza de calles,Realiza F?lix Arratia trabajos de desmonte y limpieza de calles. Sin ser gobierno a?n el alcalde electo F?lix Arratia realiz? trabajos de desmonte y limpieza...,El Porvenir,Thu Sep 12 2024 00:00:00 GMT-0600 (Central Standard Time),https://elporvenir.mx/local/realiza-felix-arratia-trabajos-de-desmonte-y-limpieza-de-calles/771482,12T2N587mMpiBpRp0h9MuRHgQ4a49pEuj,https___elporvenir_mx_local_realiza_felix_arratia_trabajos_de_desmonte_y_limpieza_de_calles_771482.jpeg
juarez n.l.; juarez nl; felix arratia,F?lix Arratia elimina jefes auxiliares para combatir corrupci?n en Ju?rez NL,Las principales funciones de los comit?s ser?n: ? Identificar necesidades prioritarias en su colonia. ? Proponer soluciones y proyectos de mejora. ? Supervisar...,POSTA,Wed Oct 09 2024 00:00:00 GMT-0600 (Central Standard Time),https://www.posta.com.mx/nuevoleon/felix-arratia-elimina-jefes-auxiliares-para-combatir-corrupcion-en-juarez-nl/vl1621234,1qzOVFTZhtaZfRe79-vx25LTv8Yv1eSsL,https___www_posta_com_mx_nuevoleon_felix_arratia_elimina_jefes_auxiliares_para_combatir_corrupcion_en_juarez_nl_vl1621234.jpeg
juarez n.l.; juarez nl; felix arratia,F?lix Arratia reducir? su sueldo; para generar recursos a Ju?rez NL,El sueldo del alcalde de Ju?rez y de los funcionarios de alto nivel disminuir? con el fin de generar recursos para el municipio.,ABCNoticias MX,Wed Oct 09 2024 00:00:00 GMT-0600 (Central Standard Time),https://abcnoticias.mx/local/2024/10/3/felix-arratia-reducira-su-sueldo-para-generar-recursos-juarez-nl-227920.html,1YF5EZzBh-qej-7Kusc7AhD362CfTNjGO,https___abcnoticias_mx_local_2024_10_3_felix_arratia_reducira_su_sueldo_para_generar_recursos_juarez_nl_227920_html.jpeg
juarez n.l.; juarez nl; felix arratia,Alcalde de Ju?rez NL se baja el sueldo? y ?corta? a aviadores,F?lix Arratia inform? que baj? su sueldo de 90 a 70 mil pesos adem?s de despedir a por lo menos 500 "aviadores" de la n?mina municipal.,Reporte Indigo,Wed Oct 09 2024 00:00:00 GMT-0600 (Central Standard Time),https://www.reporteindigo.com/reporte/alcalde-de-juarez-nl-se-baja-el-sueldo-y-corta-a-aviadores/,1KFM0dafTlfPzvoDzmDtp4NaHPKPeBKx8,https___www_reporteindigo_com_reporte_alcalde_de_juarez_nl_se_baja_el_sueldo_y_corta_a_aviadores_.jpeg
juarez n.l.; juarez nuevo leon; juarez nl,?Vives en Ju?rez y tienes adeudo en Agua y Drenaje? Checa esta informaci?n,La brigada Liquida Ahorra ofrece descuentos de hasta el 90% en adeudos de Agua y Drenaje en Ju?rez aplicable solo durante octubre 2024.,POSTA,Wed Oct 09 2024 00:00:00 GMT-0600 (Central Standard Time),https://www.posta.com.mx/nuevoleon/vives-en-juarez-y-tienes-adeudo-en-agua-y-drenaje-checa-esta-informacion/vl1619314,,
juarez nuevo leon; felix arratia,Ju?rez: Sincronizan sem?foros para mejorar la vialidad,Ju?rez: Sincronizan sem?foros para mejorar la vialidad. Para mejorar el tr?fico en Ju?rez el alcalde F?lix Arratia inici? la sincronizaci?n de sem?foros clave.,POSTA,Wed Oct 09 2024 00:00:00 GMT-0600 (Central Standard Time),https://www.posta.com.mx/nuevoleon/juarez-sincronizan-semaforos-para-mejorar-la-vialidad/vl1621991,1tKwU9JudJA2FckfzDwQnP0LIttAuprRU,https___www_posta_com_mx_nuevoleon_juarez_sincronizan_semaforos_para_mejorar_la_vialidad_vl1621991.jpeg
juarez nuevo leon; felix arratia,Avances en infraestructura y servicios p?blicos en Ju?rez Nuevo Le?n,Las acciones diarias del gobierno municipal buscan crear un ?Nuevo Ju?rez? donde los ciudadanos se sientan escuchados y atendidos. Este enfoque proactivo es...,POSTA,Wed Oct 09 2024 00:00:00 GMT-0600 (Central Standard Time),https://www.posta.com.mx/nuevoleon/avances-en-infraestructura-y-servicios-publicos-en-juarez-nuevo-leon/vl1621205,1DMu628dG4oGEyqaglF7_5A2uKavcdq9t,https___www_posta_com_mx_nuevoleon_avances_en_infraestructura_y_servicios_publicos_en_juarez_nuevo_leon_vl1621205.jpeg
juarez nuevo leon; felix arratia,F?lix Arratia anuncia recuperaci?n de veh?culos robados en Ju?rez,El alcalde de Ju?rez F?lix Arratia anunci? avances significativos en la seguridad de la ciudad destacando la recuperaci?n de varios veh?culos robados en...,POSTA,Wed Oct 09 2024 00:00:00 GMT-0600 (Central Standard Time),https://www.posta.com.mx/nuevoleon/felix-arratia-anuncia-recuperacion-de-vehiculos-robados-en-juarez/vl1620943,1wTzn3M6qfDiFwqqO4nuLgTbmRGrDmSsa,https___www_posta_com_mx_nuevoleon_felix_arratia_anuncia_recuperacion_de_vehiculos_robados_en_juarez_vl1620943.jpeg
juarez nuevo leon; felix arratia,Ju?rez da paso hacia la sostenibilidad con arborizaci?n masiva,Durante su primera semana de gesti?n el alcalde declar?: ?Ya estamos haciendo historia? al dar inicio a la plantaci?n de m?s de 440 ?rboles nativos a lo largo...,POSTA,Wed Oct 09 2024 00:00:00 GMT-0600 (Central Standard Time),https://www.posta.com.mx/nuevoleon/juarez-da-paso-hacia-la-sostenibilidad-con-arborizacion-masiva/vl1620118,1TvcgbdzqrIJrFRXoyfKwz7PVBTo_blpF,https___www_posta_com_mx_nuevoleon_juarez_da_paso_hacia_la_sostenibilidad_con_arborizacion_masiva_vl1620118.jpeg
juarez nuevo leon; felix arratia; juarez mauricio gavi?a mendieta,Designa F?lix Arratia a Mauricio Gavi?a como Secretario de Seguridad de Ju?rez,JU?REZ Nuevo Le?n.- El alcalde de Ju?rez F?lix Arratia encabez? esta ma?ana la ceremonia de cambio de mando en las corporaciones de seguridad municipal...,POSTA,Wed Oct 09 2024 00:00:00 GMT-0600 (Central Standard Time),https://www.posta.com.mx/nuevoleon/designa-felix-arratia-a-mauricio-gavina-como-secretario-de-seguridad-de-juarez/v-vl1618853,10bdMg9ti6HKOi7gk2tFmvnl4bUvZq_Qa,https___www_posta_com_mx_nuevoleon_designa_felix_arratia_a_mauricio_gavina_como_secretario_de_seguridad_de_juarez_v_vl1618853.jpeg
juarez nuevo leon; felix arratia; juarez mauricio gavi?a mendieta,F?lix Arratia ordena a nuevo secretario de seguridad proteger a Ju?rez,El alcalde de Ju?rez F?lix Arratia encabez? esta ma?ana el cambio de mando de las corporaciones de seguridad municipal e instruy? al nuevo secretario a...,Noticias Nuevo Le?n,Wed Oct 09 2024 00:00:00 GMT-0600 (Central Standard Time),https://noticiasnuevoleon.com.mx/2024/09/felix-arratia-ordena-a-nuevo-secretario-de-seguridad-proteger-a-juarez/,1iXSdRJXFWEr7guGt7MC-kX6qzcR7cAmg,https___noticiasnuevoleon_com_mx_2024_09_felix_arratia_ordena_a_nuevo_secretario_de_seguridad_proteger_a_juarez_.jpeg
juarez nuevo leon; felix arratia,Pone Arratia municipio 'a la orden' y revive a Ju?rez,F?lix Arratia rindi? protesta como alcalde de Ju?rez Nuevo Le?n y en el arranque de su trienio revivi? la imagen del Benem?rito de las Am?ricas.,El Horizonte,Wed Oct 09 2024 00:00:00 GMT-0600 (Central Standard Time),https://www.elhorizonte.mx/nuevoleon/pone-arratia-municipio-a-la-orden-y-revive-a-juarez/3701222323,10SNu_hdnOMpVvpGU6gmtuIUVkvGpEUs5,https___www_elhorizonte_mx_nuevoleon_pone_arratia_municipio_a_la_orden_y_revive_a_juarez_3701222323.jpeg
juarez nuevo leon; juarez monica oyervides; juarez adriana hernandez martinez; juarez jorge berlanga ramirez; juarez irving delgado avila; juarez carlos comsille villarreal; juarez miriam garza pe?a; juarez irene garza rodriguez; juarez cesar garcia cavazos; juarez mauricio gavi?a mendieta; juarez hugo quintanilla serrato,F?lix Guadalupe Arratia Cruz esta listo para crea una nueva historia y ascender en Ju?rez,F?lix Guadalupe Arratia Cruz rindi? protesta como alcalde del municipio de Ju?rez destacando que su administraci?n pondr? ?nfasis en la transparencia...,Noticias Nuevo Le?n,Wed Oct 09 2024 00:00:00 GMT-0600 (Central Standard Time),https://noticiasnuevoleon.com.mx/2024/09/felix-guadalupe-arratia-cruz-esta-listo-para-crea-una-nueva-historia-y-ascender-en-juarez/,1OgdoI3iHiY3lu4APA3yETk12pOGos58c,https___noticiasnuevoleon_com_mx_2024_09_felix_guadalupe_arratia_cruz_esta_listo_para_crea_una_nueva_historia_y_ascender_en_juarez_.jpeg
juarez nuevo leon; felix arratia,Asume F?lix Arratia alcald?a de Ju?rez; promete un gobierno en orden,F?lix Guadalupe Arratia Cruz tom? protesta como el alcalde de Ju?rez Nuevo Le?n. Con 31 a?os se convierte en el primer presidente municipal de Movimiento...,POSTA,Wed Oct 09 2024 00:00:00 GMT-0600 (Central Standard Time),https://www.posta.com.mx/nuevoleon/asume-felix-arratia-alcaldia-de-juarez-promete-un-gobierno-en-orden/vl1618588,1pqVDOxRH_gqF8VpPSNxD0DtV9ZW4xPxZ,https___www_posta_com_mx_nuevoleon_asume_felix_arratia_alcaldia_de_juarez_promete_un_gobierno_en_orden_vl1618588.jpeg
felix arratia,F?lix Arratia atiende a juarenses con m?s de 70 servicios gubernamentales,F?lix Arratia alcalde de Ju?rez Nuevo Le?n escucha y atiende las necesidades de los ciudadanos en un evento con m?s de 70 servicios gubernamentales.,POSTA,Wed Oct 09 2024 00:00:00 GMT-0600 (Central Standard Time),https://www.posta.com.mx/nuevoleon/felix-arratia-atiende-a-juarenses-con-mas-de-70-servicios-gubernamentales/vl1622775,1xxeasDrhsL8eBAjMdWq4YDjl_TPYnJof,https___www_posta_com_mx_nuevoleon_felix_arratia_atiende_a_juarenses_con_mas_de_70_servicios_gubernamentales_vl1622775.jpeg
felix arratia,Instalar?n 30 aulas m?viles en el municipio de Ju?rez,El edil juarense F?lix Arratia dio a conocer las principales problem?ticas a resolver en este municipio.,POSTA,Wed Oct 09 2024 00:00:00 GMT-0600 (Central Standard Time),https://www.posta.com.mx/nuevoleon/instalaran-30-aulas-moviles-en-el-municipio-de-juarez/v-vl1622699,111pJFpJ1tf8RneueiZrK1EPl5rbI9yJV,https___www_posta_com_mx_nuevoleon_instalaran_30_aulas_moviles_en_el_municipio_de_juarez_v_vl1622699.jpeg
felix arratia,F?lix inaugura biblioteca y atiende plantel,Cuadrillas municipales de Ju?rez llevaron a cabo trabajos de deshierbe limpieza pintura y renovaci?n de sanitarios en la Escuela Secundaria #4 Astolfo...,La Pol?tica Online,Wed Oct 09 2024 00:00:00 GMT-0600 (Central Standard Time),https://www.lapoliticaonline.com/mexico/en-foco-mx/felix-inaugura-biblioteca-y-atiende-plantel/,1MhF67mKyIRPrLS3vJOLQsFSPCZozchYa,https___www_lapoliticaonline_com_mexico_en_foco_mx_felix_inaugura_biblioteca_y_atiende_plantel_.jpeg
felix arratia,F?lix Arratia se compromete a mejorar seguridad de Ju?rez,F?lix Arratia se compromete a mejorar seguridad de Ju?rez. El alcalde juarense visit? POSTA en donde asegur? que trabaja con las autoridades estatales y...,POSTA,Wed Oct 09 2024 00:00:00 GMT-0600 (Central Standard Time),https://www.posta.com.mx/nuevoleon/felix-arratia-se-compromete-a-mejorar-seguridad-de-juarez/v-vl1621493,1sHcNtia9ZFm6KQTMPgzKs9JZ6iFc_tFk,https___www_posta_com_mx_nuevoleon_felix_arratia_se_compromete_a_mejorar_seguridad_de_juarez_v_vl1621493.jpeg
felix arratia,Garantiza Ju?rez que no habr? cuotas para empresas negocios y restaurantes,El anuncio de la medida fue hecho por el alcalde del municipio de Ju?rez F?lix Arratia.,POSTA,Wed Oct 09 2024 00:00:00 GMT-0600 (Central Standard Time),https://www.posta.com.mx/nuevoleon/garantiza-juarez-que-no-habra-cuotas-para-empresas-negocios-y-restaurantes/vl1620208,1o5e2GbypQOiO1PvtZTFQxinOPDrc8MXF,https___www_posta_com_mx_nuevoleon_garantiza_juarez_que_no_habra_cuotas_para_empresas_negocios_y_restaurantes_vl1620208.jpeg
felix arratia,Reduce F?lix Arratia su sueldo como alcalde de Ju?rez,Con la finalidad de generar m?s recursos municipales para invertir en programas que beneficien a todos los habitantes de Ju?rez el alcalde F?lix Arratia...,Noticias Nuevo Le?n,Wed Oct 09 2024 00:00:00 GMT-0600 (Central Standard Time),https://noticiasnuevoleon.com.mx/2024/10/reduce-felix-arratia-su-sueldo-como-alcalde-de-juarez/,1UurGnBAZkGEAFqXX7DG5gcVVn9QPO_fh,https___noticiasnuevoleon_com_mx_2024_10_reduce_felix_arratia_su_sueldo_como_alcalde_de_juarez_.jpeg
felix arratia,F?lix Arratia busca liquidar deudas ciudadanas con AyD,Emprende una brigada de liquidaci?n de deudas en la plaza municipal con la que espera beneficiar a 40000 juarenses.,La Pol?tica Online,Wed Oct 09 2024 00:00:00 GMT-0600 (Central Standard Time),https://www.lapoliticaonline.com/mexico/en-foco-mx/felix-arratia-busca-liquidar-deudas-ciudadanas-con-ayd/,1dGItUeBqEaiyYmrXwKBrNGe0zBSGdEB7,https___www_lapoliticaonline_com_mexico_en_foco_mx_felix_arratia_busca_liquidar_deudas_ciudadanas_con_ayd_.jpeg
felix arratia,Alcalde de Ju?rez en conjunto con AyD anuncian programa ?L?quida Ahorra?,Ju?rez.- El alcalde de Ju?rez F?lix Arratia en compa??a de Juan Ignacio Barrag?n titular de Agua y Drenaje de Monterrey anunci? el programa ?L?quida...,ABCNoticias.MX,Wed Oct 09 2024 00:00:00 GMT-0600 (Central Standard Time),https://abcnoticias.mx/local/2024/10/2/alcalde-de-juarez-en-conjunto-con-ayd-anuncian-programa-liquida-ahorra-227803.html,1xz5j_6k9KBHlrtzZRzn59crv6bwm8zL8,https___abcnoticias_mx_local_2024_10_2_alcalde_de_juarez_en_conjunto_con_ayd_anuncian_programa_liquida_ahorra_227803_html.jpeg
felix arratia,F?lix Arratia toma protesta como alcalde de Ju?rez; promete la extensi?n de la L?nea 1 del Metro,?Juntos hacemos un compromiso para no defraudar la confianza que las y los juarenses nos dieron a ser un gobierno incorruptible y trabajar d?a y noche para...,ABCNoticias.MX,Wed Oct 09 2024 00:00:00 GMT-0600 (Central Standard Time),https://abcnoticias.mx/local/2024/9/29/felix-arratia-toma-protesta-como-alcalde-de-juarez-promete-la-extension-de-la-linea-del-metro-227502.html,1noi0xpFtOeEmV5jwOTgkoT3kmZFImrbR,https___abcnoticias_mx_local_2024_9_29_felix_arratia_toma_protesta_como_alcalde_de_juarez_promete_la_extension_de_la_linea_del_metro_227502_html.jpeg
juarez n.l.; juarez nuevo leon; juarez nl; felix arratia,Van contra motociclistas ruidosos en Ju?rez NL; alcalde los pone a barrer calles,Durante el primer filtro realizado se retiraron de la circulaci?n 50 veh?culos ... El alcalde de Ju?rez Nuevo Le?n F?lix Arratia le declar? la ?guerra? a los...,Reporte Indigo,Sat Oct 12 2024 00:00:00 GMT-0600 (Central Standard Time),https://www.reporteindigo.com/reporte/van-contra-motociclistas-ruidosos-en-juarez-nuevo-leon-alcalde-los-pone-a-barrer-calles/,18rwhFZWgYHyyQdxVg8s2fLo-YOTeqeLq,https___www_reporteindigo_com_reporte_van_contra_motociclistas_ruidosos_en_juarez_nuevo_leon_alcalde_los_pone_a_barrer_calles_.jpeg
juarez nuevo leon; felix arratia,F?lix Arratia anuncia informe regional de Samuel Garc?a en Ju?rez Nuevo Le?n,El gobernador Samuel Garc?a ofrecer? su informe de la Regi?n Perif?rica en Ju?rez como parte de su gira 'Por Todo Nuevo Le?n'.,POSTA,Sat Oct 12 2024 00:00:00 GMT-0600 (Central Standard Time),https://www.posta.com.mx/nuevoleon/felix-arratia-anuncia-informe-regional-de-samuel-garcia-en-juarez-nuevo-leon/vl1623060,14Pf9qku5iU39pa1nkzW8a4MmYYql2Z80,https___www_posta_com_mx_nuevoleon_felix_arratia_anuncia_informe_regional_de_samuel_garcia_en_juarez_nuevo_leon_vl1623060.jpeg
felix arratia,F?lix Arratia y Manuel Guerra inician gestiones con el pie derecho en preferencia,Arrancan fuertes. Los alcaldes de Ju?rez el emecista F?lix Arratia y de Garc?a el morenista Manuel Guerra arrancan sus administraciones con un buen...,ABCNoticias.MX,Sat Oct 12 2024 00:00:00 GMT-0600 (Central Standard Time),https://abcnoticias.mx/opinion/2024/10/14/felix-arratia-manuel-guerra-inician-gestiones-con-el-pie-derecho-en-preferencia-228819.html,1QxlIl7NaIR7ekxEqpk0017Fs1EQMu7RK,https___abcnoticias_mx_opinion_2024_10_14_felix_arratia_manuel_guerra_inician_gestiones_con_el_pie_derecho_en_preferencia_228819_html.jpeg
felix arratia,Detecta F?lix Arratia falta de ?reas p?blicas en 40 fraccionamientos de Ju?rez,F?lix Arratia alcalde juarense describi? que a dos semanas de haber comenzado la administraci?n detectaron esta anomal?a en el ?rea de desarrollo urbano.,ABCNoticias.MX,Sat Oct 12 2024 00:00:00 GMT-0600 (Central Standard Time),https://abcnoticias.mx/local/2024/10/14/detecta-felix-arratia-falta-de-areas-publicas-en-40-fraccionamientos-de-juarez-228881.html,1wmi1lv8fSRt0OvOsDUyaUwXuy5xNFKho,https___abcnoticias_mx_local_2024_10_14_detecta_felix_arratia_falta_de_areas_publicas_en_40_fraccionamientos_de_juarez_228881_html.jpeg
felix arratia; juarez mauricio gavi?a mendieta,F?lix Arratia promueve el di?logo con vecinos para combatir la inseguridad en Ju?rez,F?lix Arratia alcalde de Ju?rez inform? que su secretario de seguridad frecuentemente visita las colonias de Ju?rez para conocer las necesidades de los...,ABCNoticias.MX,Sat Oct 12 2024 00:00:00 GMT-0600 (Central Standard Time),https://abcnoticias.mx/local/2024/10/14/felix-arratia-promueve-el-dialogo-con-vecinos-para-combatir-la-inseguridad-en-juarez-228885.html,1eeswyqijrKK9OEQa7duA38XuZMT1KG9r,https___abcnoticias_mx_local_2024_10_14_felix_arratia_promueve_el_dialogo_con_vecinos_para_combatir_la_inseguridad_en_juarez_228885_html.jpeg
juarez n.l.; juarez nl,Samuel Garc?a presume inversi?n extranjera de 68 mil mdd durante informe en Ju?rez NL,Samuel Garc?a asegur? que los pr?ximos tres a?os de gobierno ser?n mejores para Ju?rez. Samuel Garc?a gobernador de Nuevo Le?n. Cr?ditos: Adriana Garcino / ABC...,ABCNoticias.MX,Sat Oct 19 2024 00:00:00 GMT-0600 (Central Standard Time),https://abcnoticias.mx/local/2024/10/16/samuel-garcia-presume-inversion-extranjera-de-68-mil-mdd-durante-informe-en-juarez-nl-229115.html,1maR6OgAnNzO1ZkZAoRaJX93gY-gLMKSt,https___abcnoticias_mx_local_2024_10_16_samuel_garcia_presume_inversion_extranjera_de_68_mil_mdd_durante_informe_en_juarez_nl_229115_html.jpeg
juarez nuevo leon; felix arratia,F?lix Arratia impulsa programa de pavimentaci?n en Ju?rez,?Qu? es el programa 'Ju?rez Sin Baches y En Orden' de F?lix Arratia? Como parte de este esfuerzo el alcalde anunci? a trav?s de sus redes sociales el avance...,POSTA,Sat Oct 19 2024 00:00:00 GMT-0600 (Central Standard Time),https://www.posta.com.mx/nuevoleon/felix-arratia-impulsa-programa-de-pavimentacion-en-juarez/vl1623553,1Ecdv7cHvJldYt1AwgQFWr20cXOUfIoU_,https___www_posta_com_mx_nuevoleon_felix_arratia_impulsa_programa_de_pavimentacion_en_juarez_vl1623553.jpeg
juarez monica oyervides,DIF de Ju?rez ofrece alimentos altamente nutritivos a ni?os y adultos mayores,JU?REZ Nuevo Le?n.- El sistema para el Desarrollo Integral de la Familia (DIF) de Ju?rez ha implementado un programa de alimentaci?n balanceada dirigido a...,POSTA,Sat Oct 26 2024 00:00:00 GMT-0600 (Central Standard Time),https://www.posta.com.mx/nuevoleon/dif-de-juarez-ofrece-alimentos-altamente-nutritivos-a-ninos-y-adultos-mayores/vl1627548,1O_jQXKXHS3NYhlqjUtqEz4bJ4wTvY5C4,https___www_posta_com_mx_nuevoleon_dif_de_juarez_ofrece_alimentos_altamente_nutritivos_a_ninos_y_adultos_mayores_vl1627548.jpeg
